{
  "schema_id": "ctxvault.context-slice/v1",
  "slice_id": "2c2c3d5d3f6f48f0a1b2c3d4",
  "slice_ref": "slice://knowledge/know_proj_ctxvault_profile_v1#markdown_paragraph/137921-8f47f2a4c6a1",
  "source_ref": "knowledge://know_proj_ctxvault_profile_v1",
  "source_object_kind": "knowledge_artifact",
  "scope_kind": "project",
  "scope_value": "ctxvault",
  "workstream_ref": null,
  "slice_kind": "markdown_paragraph",
  "title": "CtxVault Project Profile (paragraph)",
  "heading_path": null,
  "line_start": 1,
  "line_end": 1,
  "byte_start": 0,
  "byte_end": 102,
  "content_sha256": "aaaaaaaaaaaaaaaaaaaaaaaaaaaaaaaaaaaaaaaaaaaaaaaaaaaaaaaaaaaaaaaa",
  "redacted_sha256": "bbbbbbbbbbbbbbbbbbbbbbbbbbbbbbbbbbbbbbbbbbbbbbbbbbbbbbbbbbbbbbbb",
  "privacy_class": "searchable_plain",
  "sensitivity": "internal",
  "redaction_state": "none",
  "token_estimate": 25,
  "updated_at": "2026-04-30T00:00:00Z",
  "redacted_preview": "CtxVault is a local-first context layer whose deterministic core remains useful without any model service.",
  "source_content_sha256": "cccccccccccccccccccccccccccccccccccccccccccccccccccccccccccccccc",
  "ranking_boost": 0.0
}
